{
  "id": "malware:bazarloader",
  "type": "malware_family",
  "name": "BazarLoader",
  "category": "loader",
  "aliases": [
    "Bazar",
    "BazarBackdoor",
    "Bazaloader",
    "KEGTAP",
    "Team9"
  ],
  "summary": "Downloader and backdoor associated with TrickBot-era cybercrime operations and used as an initial-access vector for follow-on payloads including ransomware.",
  "first_seen": {
    "value": "2020-04",
    "precision": "month",
    "scope": "family",
    "sources": [
      {
        "source": "source:mitre_attack_bazar",
        "claim": "MITRE ATT&CK says Bazar has been used since at least April 2020.",
        "locator": "software description"
      }
    ]
  },
  "tags": [
    "windows",
    "loader",
    "backdoor",
    "initial-access"
  ],
  "sources": [
    {
      "source": "source:mitre_attack_bazar",
      "claim": "MITRE ATT&CK identifies Bazar as a downloader and backdoor and lists KEGTAP, Team9, and Bazaloader as associated software names.",
      "locator": "software page"
    },
    {
      "source": "source:proofpoint_initial_access_ransomware_2021",
      "claim": "Proofpoint describes BazaLoader as a downloader used as an initial-access vector for ransomware attacks.",
      "locator": "initial access facilitators section"
    },
    {
      "source": "source:trendmicro_ryuk_trickbot_bazarloader",
      "claim": "Trend Micro reports Ryuk ransomware distribution via TrickBot and BazarLoader.",
      "locator": "report title and body"
    }
  ],
  "status": "historical"
}
