{
  "id": "malware:shadowpad",
  "type": "malware_family",
  "name": "ShadowPad",
  "category": "backdoor",
  "aliases": [
    "POISONPLUG.SHADOW"
  ],
  "summary": "Privately sold modular backdoor first publicly identified in the NetSarang supply-chain compromise.",
  "first_seen": {
    "value": "2017-07",
    "precision": "month",
    "scope": "reporting",
    "sources": [
      {
        "source": "source:mitre_attack_shadowpad",
        "claim": "MITRE ATT&CK says ShadowPad was first identified in mid-July 2017.",
        "locator": "software description"
      }
    ]
  },
  "tags": [
    "windows",
    "backdoor",
    "modular",
    "private-tooling"
  ],
  "sources": [
    {
      "source": "source:mitre_attack_shadowpad",
      "claim": "MITRE ATT&CK identifies ShadowPad as a modular backdoor.",
      "locator": "software description"
    },
    {
      "source": "source:sentinelone_shadowpad_plugx",
      "claim": "SentinelLabs describes ShadowPad as a privately sold modular malware platform.",
      "locator": "executive summary"
    }
  ],
  "status": "active"
}
