{
  "id": "malware:ursnif",
  "type": "malware_family",
  "name": "Ursnif",
  "category": "banker",
  "aliases": [
    "Gozi-ISFB",
    "Gozi ISFB",
    "Dreambot",
    "PE_URSNIF",
    "Papras",
    "Voslik"
  ],
  "summary": "Banking trojan and Gozi-family variant associated with credential theft, web injects, and actively evolving forks such as Dreambot.",
  "tags": [
    "windows",
    "banker",
    "infostealer",
    "gozi-lineage"
  ],
  "sources": [
    {
      "source": "source:mitre_attack_ursnif",
      "claim": "MITRE ATT&CK identifies Ursnif as a banking trojan and variant of Gozi, with associated software including Gozi-ISFB and Dreambot.",
      "locator": "software description"
    },
    {
      "source": "source:proofpoint_dreambot_ursnif_2016",
      "claim": "Proofpoint describes Dreambot as an active Ursnif or Gozi ISFB variant and notes other active Gozi ISFB forks.",
      "locator": "overview and conclusion"
    },
    {
      "source": "source:nhs_gozi_isfb_2017",
      "claim": "NHS Digital says the Gozi ISFB family includes the Ursnif and Dreambot trojans.",
      "locator": "summary"
    }
  ],
  "status": "active",
  "notes": "Gozi, Gozi-ISFB, ISFB, Ursnif, and Dreambot naming is treated here as one alias cluster until stronger public evidence requires separate family or variant nodes."
}
