{
  "id": "malware:hermes",
  "type": "malware_family",
  "name": "Hermes",
  "category": "ransomware",
  "aliases": [
    "Hermes 2.1"
  ],
  "summary": "Ransomware family first observed in 2017 and sold or reused by other actors, with public reporting connecting its code base to Ryuk.",
  "first_seen": {
    "value": "2017",
    "precision": "year",
    "scope": "family",
    "sources": [
      {
        "source": "source:nhs_hermes_2018",
        "claim": "NHS Digital says Hermes was first observed in 2017.",
        "locator": "summary"
      }
    ]
  },
  "tags": [
    "windows",
    "ransomware",
    "ransomware-kit"
  ],
  "sources": [
    {
      "source": "source:nhs_hermes_2018",
      "claim": "NHS Digital identifies Hermes as a ransomware tool sold to other threat actors for use in campaigns.",
      "locator": "summary"
    },
    {
      "source": "source:checkpoint_ryuk_hermes_2018",
      "claim": "Check Point describes Hermes as ransomware used in targeted attacks and compares it technically with Ryuk.",
      "locator": "overview and malware comparison"
    },
    {
      "source": "source:certfr_ryuk_2021",
      "claim": "CERT-FR/ANSSI describes Hermes 2.1 as a ransomware kit sold on an underground forum before Ryuk appeared.",
      "locator": "origins section"
    }
  ],
  "status": "historical"
}
