{
  "id": "malware:rook",
  "type": "malware_family",
  "name": "Rook",
  "category": "ransomware",
  "summary": "Ransomware family observed in late 2021 with public reverse-engineering evidence of Babuk source-code reuse.",
  "first_seen": {
    "value": "2021-11",
    "precision": "month",
    "scope": "family",
    "sources": [
      {
        "source": "source:sentinelone_rook_babuk_2021",
        "claim": "SentinelLABS says Rook operators claimed a first victim on November 30, 2021.",
        "locator": "article overview"
      }
    ]
  },
  "tags": [
    "windows",
    "ransomware",
    "babuk-descendant",
    "source-code-reuse"
  ],
  "sources": [
    {
      "source": "source:sentinelone_rook_babuk_2021",
      "claim": "SentinelLABS reports multiple code similarities between Rook and Babuk.",
      "locator": "Babuk Overlaps"
    }
  ],
  "status": "historical"
}
