{
  "id": "malware:quasarrat",
  "type": "malware_family",
  "name": "QuasarRAT",
  "category": "rat",
  "aliases": [
    "xRAT"
  ],
  "summary": "Open-source C# remote access tool publicly available on GitHub since at least 2014 and later reused across malicious campaigns.",
  "first_seen": {
    "value": "2014",
    "precision": "year",
    "scope": "repository",
    "sources": [
      {
        "source": "source:mitre_attack_quasarrat",
        "claim": "MITRE ATT&CK says QuasarRAT has been publicly available on GitHub since at least 2014.",
        "locator": "software description"
      }
    ]
  },
  "tags": [
    "windows",
    "rat",
    "open-source",
    "csharp"
  ],
  "sources": [
    {
      "source": "source:mitre_attack_quasarrat",
      "claim": "MITRE ATT&CK identifies QuasarRAT as an open-source C# remote access tool and lists xRAT as associated software.",
      "locator": "software description"
    },
    {
      "source": "source:eset_asyncrat_forks_2025",
      "claim": "ESET describes QuasarRAT as an earlier open-source tool that laid a foundation for AsyncRAT.",
      "locator": "Where does AsyncRAT come from"
    }
  ],
  "status": "unknown",
  "notes": "Kept unknown because this batch verifies identity and relationship context, not recent operational prevalence."
}
