{
  "id": "malware:ryuk",
  "type": "malware_family",
  "name": "Ryuk",
  "category": "ransomware",
  "summary": "Ransomware family associated with high-impact enterprise intrusions and code similarity to Hermes ransomware.",
  "first_seen": {
    "value": "2018",
    "precision": "year",
    "scope": "family",
    "sources": [
      {
        "source": "source:mitre_attack_ryuk",
        "claim": "MITRE ATT&CK says Ryuk has been used in attacks since at least 2018.",
        "locator": "software description"
      },
      {
        "source": "source:certfr_ryuk_2021",
        "claim": "CERT-FR/ANSSI says Ryuk was first observed in August 2018.",
        "locator": "origins section"
      }
    ]
  },
  "tags": [
    "windows",
    "ransomware",
    "enterprise"
  ],
  "sources": [
    {
      "source": "source:mitre_attack_ryuk",
      "claim": "MITRE ATT&CK identifies Ryuk as ransomware and records code similarities with Hermes ransomware.",
      "locator": "software description"
    },
    {
      "source": "source:checkpoint_ryuk_hermes_2018",
      "claim": "Check Point describes Ryuk as targeted ransomware and compares its inner workings with Hermes.",
      "locator": "overview and malware comparison"
    },
    {
      "source": "source:mcafee_ryuk_attribution_2019",
      "claim": "McAfee Labs analyzes Ryuk's relationship to Hermes while cautioning against overconfident actor attribution.",
      "locator": "technical indicators"
    }
  ],
  "status": "historical"
}
