{
  "id": "malware:clop",
  "type": "malware_family",
  "name": "Clop",
  "category": "ransomware",
  "aliases": [
    "Cl0p"
  ],
  "summary": "Ransomware family first observed in 2019 and later associated with large-scale extortion operations.",
  "first_seen": {
    "value": "2019-02",
    "precision": "month",
    "scope": "family",
    "sources": [
      {
        "source": "source:mitre_attack_clop",
        "claim": "MITRE ATT&CK says Clop was first observed in February 2019.",
        "locator": "software description"
      }
    ]
  },
  "tags": [
    "windows",
    "ransomware",
    "extortion"
  ],
  "sources": [
    {
      "source": "source:mitre_attack_clop",
      "claim": "MITRE ATT&CK identifies Clop as a ransomware family.",
      "locator": "software description"
    },
    {
      "source": "source:nhs_clop_cryptomix",
      "claim": "NHS Digital describes Clop as a CryptoMix variant.",
      "locator": "alert"
    }
  ],
  "status": "active"
}
