{
  "id": "malware:shamoon",
  "type": "malware_family",
  "name": "Shamoon",
  "category": "wiper",
  "aliases": [
    "Disttrack"
  ],
  "summary": "Wiper malware first used in 2012 and known for destructive disk overwrite behavior.",
  "first_seen": {
    "value": "2012",
    "precision": "year",
    "scope": "family",
    "sources": [
      {
        "source": "source:mitre_attack_shamoon",
        "claim": "MITRE ATT&CK says Shamoon was first used in 2012.",
        "locator": "software description"
      }
    ]
  },
  "tags": [
    "windows",
    "wiper"
  ],
  "sources": [
    {
      "source": "source:mitre_attack_shamoon",
      "claim": "MITRE ATT&CK identifies Shamoon as wiper malware and notes its Disttrack alias.",
      "locator": "software description"
    }
  ],
  "status": "historical"
}
