{
  "id": "malware:hades",
  "type": "malware_family",
  "name": "Hades",
  "category": "ransomware",
  "summary": "Ransomware family publicly associated with the Evil Corp/Indrik Spider ecosystem alongside Dridex, BitPaymer, and WastedLocker.",
  "tags": [
    "windows",
    "ransomware",
    "evil-corp",
    "indrik-spider"
  ],
  "sources": [
    {
      "source": "source:crowdstrike_indrik_spider",
      "claim": "CrowdStrike identifies Indrik Spider as behind the development of Dridex, BitPaymer, WastedLocker, and Hades.",
      "locator": "adversary description"
    }
  ],
  "status": "historical"
}
