{
  "id": "malware:dharma",
  "type": "malware_family",
  "name": "Dharma",
  "category": "ransomware",
  "aliases": [
    "CrySiS",
    "Crysis"
  ],
  "summary": "Ransomware family also known as CrySiS, known since 2016 and later tied to the Phobos ransomware ecosystem.",
  "first_seen": {
    "value": "2016",
    "precision": "year",
    "scope": "family",
    "sources": [
      {
        "source": "source:acronis_dharma_crysis_2020",
        "claim": "Acronis describes Dharma as known since 2016 as the CrySiS ransomware family.",
        "locator": "article title and overview"
      }
    ]
  },
  "tags": [
    "windows",
    "ransomware",
    "crysis"
  ],
  "sources": [
    {
      "source": "source:acronis_dharma_crysis_2020",
      "claim": "Acronis treats Dharma and CrySiS as naming-continuous ransomware.",
      "locator": "article overview"
    },
    {
      "source": "source:hhs_hc3_phobos_2021",
      "claim": "HHS HC3 describes Dharma and CrySiS as related to Phobos ransomware.",
      "locator": "Report"
    }
  ],
  "status": "historical"
}
