{
  "id": "malware:revil",
  "type": "malware_family",
  "name": "REvil",
  "category": "ransomware",
  "aliases": [
    "Sodinokibi",
    "Sodin"
  ],
  "summary": "Highly configurable Ransomware-as-a-Service family also known as Sodinokibi.",
  "tags": [
    "windows",
    "ransomware",
    "raas"
  ],
  "sources": [
    {
      "source": "source:mitre_attack_revil",
      "claim": "MITRE ATT&CK identifies REvil as ransomware and notes code similarities with GandCrab RaaS.",
      "locator": "software description"
    },
    {
      "source": "source:mcafee_sodinokibi_gandcrab",
      "claim": "McAfee analyzed Sodinokibi/REvil as Ransomware-as-a-Service and compared it with GandCrab code.",
      "locator": "analysis"
    }
  ],
  "status": "historical"
}
