{
  "id": "malware:esxiargs",
  "type": "malware_family",
  "name": "ESXiArgs",
  "category": "ransomware",
  "summary": "Ransomware campaign targeting VMware ESXi servers in 2023; public guidance exists, while Babuk derivation claims remain contested.",
  "first_seen": {
    "value": "2023-02",
    "precision": "month",
    "scope": "reporting",
    "sources": [
      {
        "source": "source:cisa_esxiargs_2023",
        "claim": "CISA and FBI released ESXiArgs ransomware recovery guidance in February 2023.",
        "locator": "Summary"
      }
    ]
  },
  "tags": [
    "linux",
    "esxi",
    "ransomware",
    "vmware"
  ],
  "sources": [
    {
      "source": "source:cisa_esxiargs_2023",
      "claim": "CISA and FBI identify ESXiArgs as a ransomware campaign affecting VMware ESXi servers.",
      "locator": "Summary"
    },
    {
      "source": "source:sentinelone_babuk_esxi_lockers_2023",
      "claim": "SentinelLABS cautions that ESXiArgs shows little Babuk similarity beyond shared open-source cryptographic library usage.",
      "locator": "ESXiArgs section"
    }
  ],
  "status": "historical",
  "notes": "Kept separate from Babuk-derived edges because the strongest reverse-engineering source cautions against that attribution."
}
