{
  "id": "malware:gafgyt",
  "type": "malware_family",
  "name": "Gafgyt",
  "category": "botnet",
  "aliases": [
    "BASHLITE",
    "Bashlite"
  ],
  "summary": "Linux IoT DDoS botnet family, also known as BASHLITE, whose ecosystem overlaps with Mirai through source-code lineage and later module reuse.",
  "first_seen": {
    "value": "2014",
    "precision": "year",
    "scope": "family",
    "sources": [
      {
        "source": "source:trendmicro_gafgyt_threat_encyclopedia",
        "claim": "Trend Micro reports GAFGYT/BASHLITE was first discovered in 2014.",
        "locator": "threat encyclopedia overview"
      }
    ]
  },
  "tags": [
    "linux",
    "iot",
    "botnet",
    "ddos"
  ],
  "sources": [
    {
      "source": "source:trendmicro_gafgyt_threat_encyclopedia",
      "claim": "Trend Micro describes GAFGYT/BASHLITE as a Linux-based IoT botnet that targets vulnerable devices and uses them for large-scale DDoS attacks.",
      "locator": "overview"
    },
    {
      "source": "source:uptycs_gafgyt_mirai_reuse_2021",
      "claim": "Uptycs describes Gafgyt as a prominent malware family for Unix-like systems targeting vulnerable IoT devices.",
      "locator": "Gafgyt section"
    },
    {
      "source": "source:bashlite_mirai_evolution_2018",
      "claim": "The Bashlite/Mirai evolution paper compares Bashlite and Mirai as major IoT botnet families and frames Mirai as Bashlite's successor.",
      "locator": "abstract and section II"
    }
  ],
  "status": "active",
  "notes": "The alias Qbot is intentionally not modeled here because QBot/Qbot is also widely used for QakBot in Windows banking-malware reporting."
}
