{
  "id": "malware:lumma",
  "type": "malware_family",
  "name": "Lumma Stealer",
  "category": "infostealer",
  "aliases": [
    "LummaC2 Stealer"
  ],
  "summary": "C-language information stealer sold through a Malware-as-a-Service model and focused on cryptocurrency wallets, browser extensions, and sensitive host data.",
  "first_seen": {
    "value": "2022",
    "precision": "year",
    "scope": "family",
    "sources": [
      {
        "source": "source:mitre_attack_lumma",
        "claim": "MITRE ATT&CK describes Lumma Stealer as in use since at least 2022.",
        "locator": "software description"
      }
    ]
  },
  "tags": [
    "windows",
    "infostealer",
    "maas"
  ],
  "sources": [
    {
      "source": "source:mitre_attack_lumma",
      "claim": "MITRE ATT&CK identifies Lumma Stealer as an information stealer malware family also known as LummaStealer.",
      "locator": "software page"
    }
  ],
  "status": "active",
  "notes": "Keep early Lumma relationships conservative; start with taxonomy, behavior, and source records."
}
