{
  "id": "malware:tdl4",
  "type": "variant",
  "name": "TDL-4",
  "category": "rootkit",
  "summary": "TDSS rootkit variant appearing in 2010 with 32-bit and 64-bit components and Master Boot Record infection behavior.",
  "first_seen": {
    "value": "2010",
    "precision": "year",
    "scope": "family",
    "sources": [
      {
        "source": "source:securelist_tdss_tdl4_2010",
        "claim": "Kaspersky Securelist says TDL-4 appeared between July and August 2010.",
        "locator": "article introduction"
      }
    ]
  },
  "tags": [
    "windows",
    "rootkit",
    "bootkit",
    "botnet"
  ],
  "sources": [
    {
      "source": "source:securelist_tdss_tdl4_2010",
      "claim": "Kaspersky Securelist describes TDL-4 as a new TDSS rootkit variant with both 32-bit and 64-bit operating-system support.",
      "locator": "article introduction and components"
    }
  ],
  "status": "historical"
}
