{
  "id": "malware:triton",
  "type": "malware_family",
  "name": "Triton",
  "category": "ics_sabotage",
  "aliases": [
    "TRISIS",
    "HatMan"
  ],
  "summary": "ICS-focused attack framework built to interact with Triconex Safety Instrumented System controllers and capable of unsafe safety-system manipulation.",
  "first_seen": {
    "value": "2017",
    "precision": "year",
    "scope": "reporting",
    "sources": [
      {
        "source": "source:dragos_xenotime",
        "claim": "Dragos says XENOTIME rose to prominence when TRISIS/TRITON was publicly detailed in December 2017.",
        "locator": "threat description"
      }
    ]
  },
  "tags": [
    "ics",
    "safety-system",
    "triconex",
    "sabotage"
  ],
  "sources": [
    {
      "source": "source:mitre_attack_triton",
      "claim": "MITRE ATT&CK identifies Triton as malware built to interact with Triconex Safety Instrumented System controllers and lists TRISIS and HatMan as associated names.",
      "locator": "software page"
    },
    {
      "source": "source:cisa_hatman_mar_2019",
      "claim": "CISA describes HatMan, also known as TRITON and TRISIS, as malware affecting Triconex Tricon safety controllers by modifying in-memory firmware.",
      "locator": "overview"
    },
    {
      "source": "source:dragos_xenotime",
      "claim": "Dragos describes TRISIS/TRITON as destructive malware targeting Schneider Electric Triconex safety instrumented systems.",
      "locator": "threat description"
    }
  ],
  "status": "historical",
  "notes": "Modeled as ICS sabotage rather than generic wiper because the core behavior targets safety-system control logic, not ordinary file wiping."
}
