{
  "id": "malware:darkgate",
  "type": "malware_family",
  "name": "DarkGate",
  "category": "loader",
  "summary": "Delphi malware-as-a-service family used for initial access, data gathering, credential theft, and follow-on payload deployment in criminal cyber operations.",
  "first_seen": {
    "value": "2018",
    "precision": "year",
    "scope": "family",
    "sources": [
      {
        "source": "source:mitre_attack_darkgate",
        "claim": "MITRE ATT&CK says DarkGate first emerged in 2018.",
        "locator": "software description"
      },
      {
        "source": "source:trellix_darkgate_maas_2023",
        "claim": "Trellix describes DarkGate as first discovered in 2018.",
        "locator": "introduction"
      }
    ]
  },
  "tags": [
    "windows",
    "loader",
    "rat",
    "maas",
    "initial-access"
  ],
  "sources": [
    {
      "source": "source:mitre_attack_darkgate",
      "claim": "MITRE ATT&CK identifies DarkGate as a Windows malware family associated with initial access, data gathering, credential theft, cryptomining, cryptotheft, and pre-ransomware actions.",
      "locator": "software page"
    },
    {
      "source": "source:trellix_darkgate_maas_2023",
      "claim": "Trellix analyzes DarkGate as a malware-as-a-service family with a multistage loader and modular payload capabilities.",
      "locator": "loader and payload sections"
    },
    {
      "source": "source:proofpoint_darkgate_battleroyal_2023",
      "claim": "Proofpoint describes DarkGate as competing in the RAT and loader category and being distributed by multiple cybercrime actors through email, Teams, Skype, malvertising, and fake updates.",
      "locator": "overview"
    }
  ],
  "status": "active"
}
