{
  "id": "malware:stuxnet",
  "type": "malware_family",
  "name": "Stuxnet",
  "category": "ics_sabotage",
  "summary": "ICS-focused malware known for sabotage behavior and rootkit techniques used to hide manipulation of industrial control processes.",
  "tags": [
    "windows",
    "ics",
    "rootkit",
    "sabotage"
  ],
  "sources": [
    {
      "source": "source:mitre_attack_stuxnet",
      "claim": "MITRE ATT&CK identifies Stuxnet and maps it across Enterprise and ICS techniques.",
      "locator": "software page"
    }
  ],
  "status": "historical"
}
