{
  "id": "malware:smoke_loader",
  "type": "malware_family",
  "name": "Smoke Loader",
  "category": "loader",
  "aliases": [
    "SmokeLoader",
    "Smoke Bot",
    "Dofoil"
  ],
  "summary": "Long-running malicious bot and loader used to install additional payloads, with self-protection, deception, and plugin capabilities.",
  "first_seen": {
    "value": "2011",
    "precision": "year",
    "scope": "family",
    "sources": [
      {
        "source": "source:mitre_attack_smoke_loader",
        "claim": "MITRE ATT&CK says Smoke Loader has been seen in the wild since at least 2011.",
        "locator": "software description"
      }
    ]
  },
  "tags": [
    "windows",
    "loader",
    "bot",
    "plugins",
    "operation-endgame"
  ],
  "sources": [
    {
      "source": "source:mitre_attack_smoke_loader",
      "claim": "MITRE ATT&CK identifies Smoke Loader as a malicious bot application that can load other malware and lists Dofoil as an associated name.",
      "locator": "software page"
    },
    {
      "source": "source:fbi_operation_endgame_2024",
      "claim": "The FBI says Operation Endgame neutralized threats from at least four malware groups including Smokeloader.",
      "locator": "operation summary"
    }
  ],
  "status": "unknown"
}
