{
  "id": "malware:maze",
  "type": "malware_family",
  "name": "Maze",
  "category": "ransomware",
  "aliases": [
    "ChaCha"
  ],
  "summary": "Ransomware family discovered in 2019 and associated with public data-theft extortion that shaped later ransomware-as-a-service pressure tactics.",
  "first_seen": {
    "value": "2019-05",
    "precision": "month",
    "scope": "family",
    "sources": [
      {
        "source": "source:mitre_attack_maze",
        "claim": "MITRE ATT&CK says Maze, previously known as ChaCha, was discovered in May 2019.",
        "locator": "software description"
      },
      {
        "source": "source:sophos_maze_one_year_2020",
        "claim": "Sophos reports the Maze brand was first affixed to the ransomware in May 2019.",
        "locator": "article body"
      }
    ]
  },
  "tags": [
    "windows",
    "ransomware",
    "raas",
    "double-extortion"
  ],
  "sources": [
    {
      "source": "source:mitre_attack_maze",
      "claim": "MITRE ATT&CK identifies Maze as ransomware that encrypts systems and posts stolen information online for extortion.",
      "locator": "software description"
    },
    {
      "source": "source:sophos_maze_one_year_2020",
      "claim": "Sophos describes Maze as a ransomware operation prominent for public exposure of stolen victim data.",
      "locator": "article body"
    }
  ],
  "status": "historical"
}
