{
  "id": "malware:egregor",
  "type": "malware_family",
  "name": "Egregor",
  "category": "ransomware",
  "summary": "Ransomware-as-a-service family first observed in September 2020, linked in public reporting to Maze operator/affiliate transition and Sekhmet-derived code.",
  "first_seen": {
    "value": "2020-09",
    "precision": "month",
    "scope": "family",
    "sources": [
      {
        "source": "source:mitre_attack_egregor",
        "claim": "MITRE ATT&CK says Egregor was first observed in September 2020.",
        "locator": "software description"
      },
      {
        "source": "source:fbi_egregor_pin_2021",
        "claim": "The FBI says it first observed Egregor ransomware in September 2020.",
        "locator": "summary"
      }
    ]
  },
  "tags": [
    "windows",
    "ransomware",
    "raas",
    "double-extortion"
  ],
  "sources": [
    {
      "source": "source:mitre_attack_egregor",
      "claim": "MITRE ATT&CK identifies Egregor as Ransomware-as-a-Service and notes reported code similarities with Sekhmet and Maze.",
      "locator": "software description"
    },
    {
      "source": "source:nhs_egregor_2020",
      "claim": "NHS Digital identifies Egregor as a RaaS tool targeting high-value organizations.",
      "locator": "summary"
    },
    {
      "source": "source:sophos_egregor_maze_heir_2020",
      "claim": "Sophos describes Egregor as a Sekhmet-derived ransomware brand emerging as Maze shut down.",
      "locator": "article body"
    }
  ],
  "status": "historical"
}
