{
  "id": "malware:prolock",
  "type": "malware_family",
  "name": "ProLock",
  "category": "ransomware",
  "summary": "Ransomware strain used in big-game-hunting operations since at least 2020.",
  "first_seen": {
    "value": "2020",
    "precision": "year",
    "scope": "family",
    "sources": [
      {
        "source": "source:mitre_attack_prolock",
        "claim": "MITRE ATT&CK says ProLock has been used since at least 2020.",
        "locator": "software description"
      }
    ]
  },
  "tags": [
    "windows",
    "ransomware"
  ],
  "sources": [
    {
      "source": "source:mitre_attack_prolock",
      "claim": "MITRE ATT&CK identifies ProLock as a ransomware strain used in big-game-hunting operations.",
      "locator": "software description"
    }
  ],
  "status": "historical"
}
