{
  "id": "malware:risepro",
  "type": "malware_family",
  "name": "RisePro",
  "category": "infostealer",
  "summary": "Information stealer distributed through downloaders and used to steal credit-card information, passwords, and personal data.",
  "tags": [
    "windows",
    "infostealer"
  ],
  "sources": [
    {
      "source": "source:blackberry_risepro_2024",
      "claim": "BlackBerry identifies RisePro as a multifunctional information stealer sold as a Malware-as-a-Service offering.",
      "locator": "summary"
    }
  ],
  "status": "active",
  "notes": "Treat RisePro as market and distribution context until stronger source-backed lineage claims are reviewed."
}
